あなたのモテ期は、かなり先です,あなたのモテ期到来は、まだ先の話ですね。下手をすれば、年単位で待たなければならず、夢のモテモテライフがスタートするまでにはまだけっこうな時間があるので、それまでに、人間的魅力を磨いておくことをおすすめします。人間的魅力が増せば増すほど、モテ期が到来したときに、素敵な相手を捕まえられる確率が上がるでしょう。自分磨きを怠っていると、いざモテ期が到来しても、どうでもいい相手にしかモテない…なんてことになりかねないので注意してくださいね。
あなたのモテ期は、ちょっと先です,あなたのモテ期は、まだ少し先ですが、けっこう近づいていますね。早ければ1年後くらいには、ぐっとモテ度がアップする時期がやってくるはずです。1年という期間は、人を変えるのに十分な時間といえます。たとえば今からダイエットをすれば、ぽっちゃり体型だったとしても、万全の状態でモテ期を迎えられるでしょう。ただ、毎日を適当になんとなく過ごしちゃうと、1年なんて一瞬です。これから1年間をどう過ごすかで、いざモテ期がやってきた際の充実度が決まるといっても過言ではありません。
あなたのモテ期はもうすぐです,あなたのモテ期は、かなり近いですね。1ヵ月先とか、3ヵ月先とか、そのくらいのレベルで、あなたにモテのビッグウェーブが迫っています。これからあなたがやるべきことは、モテ期を迎える準備です。心躍るようなイベントがたくさん発生すると思うので、いつでも時間を作れるように、面倒な課題や仕事は前倒しで進めておきましょう。部屋の掃除にも普段以上に力を入れて、オシャレな服や靴なんかも買っておいた方がいいでしょう。
ただ、すでにあなたに恋人がいる場合は、気を付けてくださいね。モテ期は浮気イベントの発生率も飛躍的に高まります。あなたに相当の覚悟がなければ、平穏無事には終わらないでしょう。今の恋人と別れたくないなら、異性と出会いそうなイベントはなるべく避けて、なるべく地味に暮らしましょう。
あなたのモテ期はもうすぐです,あなたのモテ期は、かなり近いですね。1ヵ月先とか、3ヵ月先とか、そのくらいのレベルで、あなたにモテのビッグウェーブが迫っています。これからあなたがやるべきことは、モテ期を迎える準備です。心躍るようなイベントがたくさん発生すると思うので、いつでも時間を作れるように、面倒な課題や仕事は前倒しで進めておきましょう。部屋の掃除にも普段以上に力を入れて、オシャレな服や靴なんかも買っておいた方がいいでしょう。
ただ、すでにあなたに恋人がいる場合は、気を付けてくださいね。モテ期は浮気イベントの発生率も飛躍的に高まります。あなたに相当の覚悟がなければ、平穏無事には終わらないでしょう。今の恋人と別れたくないなら、異性と出会いそうなイベントはなるべく避けて、なるべく地味に暮らしましょう。
あなたのモテ期は、まさに今です,おめでとうございます☆あなたは、今がまさに、モテ期のまっただなかにいるようですね。さぞかし充実した日々を過ごしているのではないでしょうか。え？ そんな自覚がまったくないって？ おかしいですね。あなたがもし今、モテていないとしたら、それは消極的な姿勢が原因かもしれません。たとえばいつも家にこもっていて新しい出会いがない状態だと、なかなかモテを感じられないでしょう。また、自分に自信がないと、相手がチラリと好意をアピールしてきても、「そんなわけない。気のせい気のせい」なんて感じでスルーしちゃったりするかも…。
今のあなたは通常よりもモテ度が高まっているので、とにかく積極的に行動することをおすすめします。肉食系の動物にでもなったつもりで、素敵な異性にはガンガンアピールしてみましょう。
